{
  "schema_version": "1.0",
  "name": "reference-bridge",
  "transport": "json-subprocess",
  "command": ["python", "examples/adapter_bridge_reference.py"],
  "cwd": "..",
  "timeout_seconds": 10,
  "max_input_bytes": 2097152,
  "max_output_bytes": 2097152,
  "max_stderr_bytes": 65536,
  "env_names": [],
  "model_id": "reference-noop"
}
